{
  "status_schema_version": 1,
  "contract_version": "5.2",
  "build_id": "test-fixture-mixed-registry",
  "runtime_config_hash": "abc123",
  "supported_profiles": ["CSP"],
  "enforced_profile": "CSP",

  "trading_mode": "ReduceOnly",
  "risk_state": "Healthy",
  "bunker_mode_active": false,
  "connectivity_degraded": false,

  "policy_age_sec": 5,
  "last_policy_update_ts": 1769440510000,

  "f1_cert_state": "PASS",
  "f1_cert_expires_at": 1769526910000,

  "disk_used_pct": 0.35,
  "disk_used_last_update_ts_ms": 1769440510000,
  "disk_used_pct_secondary": 0.35,
  "disk_used_secondary_last_update_ts_ms": 1769440510000,

  "mm_util": 0.15,
  "mm_util_last_update_ts_ms": 1769440510000,

  "loop_tick_last_ts_ms": 1769440510600,

  "atomic_naked_events_24h": 0,
  "429_count_5m": 0,
  "10028_count_5m": 0,

  "wal_queue_depth": 10,
  "wal_queue_capacity": 1024,
  "wal_queue_enqueue_failures": 0,

  "deribit_http_p95_ms": 120,
  "ws_event_lag_ms": 25,

  "mode_reasons": ["REDUCEONLY_POLICY_STALE", "REDUCEONLY_INPUT_MISSING_OR_STALE"],

  "open_permission_blocked_latch": false,
  "open_permission_reason_codes": [],
  "open_permission_requires_reconcile": false,

  "owner_view": {
    "primary_owner_reason_code": "REDUCEONLY_POLICY_STALE",
    "owner_message": "Policy/input freshness degraded; system remains ReduceOnly until freshness recovers.",
    "unblock": [
      {
        "type": "AUTO",
        "condition": "policy_age_sec <= 60",
        "current": "policy_age_sec=5",
        "target": "policy_age_sec<=60"
      },
      {
        "type": "AUTO",
        "condition": "required_inputs_fresh == true",
        "current": "required_inputs_fresh=false",
        "target": "required_inputs_fresh=true"
      }
    ]
  }
}
