{
  "status_schema_version": 1,
  "contract_version": "5.2",
  "build_id": "fixture-foundation-status-lite",
  "runtime_config_hash": "fixture-config-foundation-lite",
  "supported_profiles": ["CSP"],
  "enforced_profile": "CSP",
  "trading_mode": "Active",
  "risk_state": "Healthy",
  "bunker_mode_active": false,
  "connectivity_degraded": false,
  "mode_reasons": [],
  "open_permission_blocked_latch": false,
  "open_permission_reason_codes": [],
  "open_permission_requires_reconcile": false,
  "policy_age_sec": 2,
  "last_policy_update_ts": 1769440000000,
  "f1_cert_state": "PASS",
  "f1_cert_expires_at": 1769526400000,
  "disk_used_pct": 0.35,
  "disk_used_last_update_ts_ms": 1769440000000,
  "disk_used_pct_secondary": 0.34,
  "disk_used_secondary_last_update_ts_ms": 1769440000000,
  "mm_util": 0.12,
  "mm_util_last_update_ts_ms": 1769440000000,
  "loop_tick_last_ts_ms": 1769440000100,
  "wal_queue_depth": 0,
  "wal_queue_capacity": 1024,
  "wal_queue_enqueue_failures": 0,
  "atomic_naked_events_24h": 0,
  "429_count_5m": 0,
  "10028_count_5m": 0,
  "deribit_http_p95_ms": 90,
  "ws_event_lag_ms": 20
}
