{
  "status_schema_version": 1,
  "contract_version": "5.2",
  "build_id": "test-fixture-wal-backpressure",
  "runtime_config_hash": "abc123",
  "supported_profiles": ["CSP"],
  "enforced_profile": "CSP",

  "trading_mode": "ReduceOnly",
  "risk_state": "Degraded",
  "bunker_mode_active": false,
  "connectivity_degraded": false,

  "policy_age_sec": 6,
  "last_policy_update_ts": 1769440510000,

  "f1_cert_state": "PASS",
  "f1_cert_expires_at": 1769526910000,

  "disk_used_pct": 0.44,
  "disk_used_last_update_ts_ms": 1769440510000,
  "disk_used_pct_secondary": 0.44,
  "disk_used_secondary_last_update_ts_ms": 1769440510000,

  "mm_util": 0.19,
  "mm_util_last_update_ts_ms": 1769440510000,

  "loop_tick_last_ts_ms": 1769440510600,

  "atomic_naked_events_24h": 0,
  "429_count_5m": 0,
  "10028_count_5m": 0,

  "wal_queue_depth": 1024,
  "wal_queue_capacity": 1024,
  "wal_queue_enqueue_failures": 17,

  "deribit_http_p95_ms": 145,
  "ws_event_lag_ms": 45,

  "mode_reasons": ["REDUCEONLY_RISKSTATE_DEGRADED"],

  "open_permission_blocked_latch": false,
  "open_permission_reason_codes": [],
  "open_permission_requires_reconcile": false,

  "owner_view": {
    "primary_owner_reason_code": "EXEC_WAL_WRITE_FAILED",
    "owner_message": "Intent ledger is backpressured; OPEN dispatch is fail-closed until WAL is healthy again.",
    "unblock": [
      {
        "type": "AUTO",
        "condition": "wal_queue_depth < wal_queue_capacity AND wal_queue_enqueue_failures stops increasing for >= 60s",
        "current": "wal_queue_depth=1024, wal_queue_enqueue_failures=17",
        "target": "wal_queue_depth<1024 and failures stable"
      }
    ]
  }
}
