{
  "status_schema_version": 1,
  "contract_version": "5.2",
  "build_id": "fixture-legacy-v1-pass",
  "runtime_config_hash": "fixture-config",
  "supported_profiles": ["CSP"],
  "enforced_profile": "CSP",

  "trading_mode": "ReduceOnly",
  "risk_state": "Degraded",
  "bunker_mode_active": false,
  "connectivity_degraded": true,

  "policy_age_sec": 4,
  "last_policy_update_ts": 0,

  "f1_cert_state": "PASS",
  "f1_cert_expires_at": 0,

  "disk_used_pct": 0.39,
  "disk_used_last_update_ts_ms": 0,
  "disk_used_pct_secondary": 0.38,
  "disk_used_secondary_last_update_ts_ms": 0,

  "mm_util": 0.21,
  "mm_util_last_update_ts_ms": 0,

  "loop_tick_last_ts_ms": 0,

  "atomic_naked_events_24h": 0,
  "429_count_5m": 0,
  "10028_count_5m": 0,

  "wal_queue_depth": 0,
  "wal_queue_capacity": 1024,
  "wal_queue_enqueue_failures": 0,

  "deribit_http_p95_ms": 120,
  "ws_event_lag_ms": 0,

  "mode_reasons": [
    "REDUCEONLY_OPEN_PERMISSION_LATCHED"
  ],

  "open_permission_blocked_latch": true,
  "open_permission_reason_codes": [
    "RESTART_RECONCILE_REQUIRED"
  ],
  "open_permission_requires_reconcile": true,

  "owner_view": {
    "primary_owner_reason_code": "RESTART_RECONCILE_REQUIRED",
    "owner_message": "System restarted; reconciliation required before new OPEN risk.",
    "unblock": [
      {
        "type": "AUTO",
        "condition": "reconciliation_success == true",
        "current": "reconciliation=running",
        "target": "reconciliation=success"
      }
    ]
  }
}
