{
  "status_schema_version": 1,
  "contract_version": "5.2",
  "build_id": "test-fixture-force-kill",
  "runtime_config_hash": "abc123",
  "supported_profiles": ["CSP"],
  "enforced_profile": "CSP",

  "trading_mode": "Kill",
  "risk_state": "Healthy",
  "bunker_mode_active": false,
  "connectivity_degraded": false,

  "policy_age_sec": 3,
  "last_policy_update_ts": 1769440710000,

  "f1_cert_state": "PASS",
  "f1_cert_expires_at": 1769527110000,

  "disk_used_pct": 0.39,
  "disk_used_last_update_ts_ms": 1769440710000,
  "disk_used_pct_secondary": 0.39,
  "disk_used_secondary_last_update_ts_ms": 1769440710000,

  "mm_util": 0.16,
  "mm_util_last_update_ts_ms": 1769440710000,

  "loop_tick_last_ts_ms": 1769440710300,

  "atomic_naked_events_24h": 0,
  "429_count_5m": 0,
  "10028_count_5m": 0,

  "wal_queue_depth": 0,
  "wal_queue_capacity": 1024,
  "wal_queue_enqueue_failures": 0,

  "deribit_http_p95_ms": 120,
  "ws_event_lag_ms": 20,

  "mode_reasons": ["KILL_CORTEX_FORCE_KILL"],

  "open_permission_blocked_latch": false,
  "open_permission_reason_codes": [],
  "open_permission_requires_reconcile": false,

  "owner_view": {
    "primary_owner_reason_code": "EXEC_UNMAPPED_REASON_CODE",
    "owner_message": "Contract/registry violation detected; system forced Kill (fail-closed).",
    "unblock": [
      {
        "type": "MANUAL",
        "condition": "fix registry drift + rebuild + redeploy (build_id/config_hash must change)",
        "current": "unknown_token_detected=true",
        "target": "no_unknown_tokens + new_build_deployed"
      }
    ]
  }
}
